{
  "$schema": "http://json-schema.org/draft-07/schema#",
  "$id": "https://phd-thesis-butler/schemas/evidence_binding_record.schema.json",
  "title": "Evidence Binding Record",
  "description": "A single binding linking a thesis claim to a source with an assigned evidence role. Version 1.0.",
  "type": "object",
  "required": [
    "binding_id",
    "chapter",
    "claim_type",
    "required_evidence_roles"
  ],
  "properties": {
    "binding_id": {
      "type": "string",
      "description": "Unique binding identifier. Referenced by chapter_evidence_map.bound_records[].binding_id",
      "pattern": "^BIND-[A-Z0-9]+-[0-9]+$"
    },
    "chapter": {
      "type": "string",
      "description": "Target chapter: INTRO/SURVEY/THEORY/MODEL/METHOD/EXPERIMENT/RESULT/DISCUSSION/CONCLUSION",
      "pattern": "^CH[1-8]$"
    },
    "chapter_function": {
      "type": "string",
      "description": "Functional role of the chapter, e.g. 'introduction', 'literature_review', 'methodology', 'architecture', 'evaluation', 'results', 'discussion', 'conclusion'"
    },
    "claim_text": {
      "type": "string",
      "description": "The exact sentence or passage from the thesis that makes a claim. Example (RU): 'BERT представляет собой трансформер-энкодер, обученный на корпусе из 3.3 млрд слов.'"
    },
    "claim_type": {
      "type": "string",
      "enum": [
        "factual_claim",
        "methodological_claim",
        "evaluative_claim",
        "gap_claim",
        "contribution_claim",
        "theoretical_claim",
        "descriptive_claim",
        "common_knowledge"
      ],
      "description": "Type of claim this evidence supports"
    },
    "required_evidence_roles": {
      "type": "array",
      "items": {
        "type": "string",
        "enum": [
          "background_context",
          "research_gap",
          "definition",
          "method_basis",
          "method_comparison",
          "benchmark",
          "validation_standard",
          "empirical_support",
          "contradiction",
          "contribution_positioning",
          "structure_reference",
          "supplementary_detail"
        ],
        "description": "Evidence roles needed to support this claim; aggregated as evidence_role in chapter_evidence_map"
      },
      "minItems": 1,
      "description": "Evidence roles needed to support this claim"
    },
    "matched_source_ids": {
      "type": "array",
      "items": {
        "type": "string",
        "description": "Source IDs that provide evidence; summarized as source_id in chapter_evidence_map"
      },
      "description": "IDs of sources matched to this binding, e.g. ['SRC-2024-001', 'SRC-2023-042']"
    },
    "evidence_strength": {
      "type": "string",
      "enum": [
        "strong",
        "medium",
        "weak",
        "none"
      ],
      "description": "Strength of the evidence binding: strong (peer-reviewed, direct match), medium (relevant but indirect), weak (tangentially related), none (no source matched)"
    },
    "gap_status": {
      "type": "string",
      "enum": [
        "covered",
        "partial",
        "missing",
        "not_needed"
      ],
      "description": "Current coverage status: covered (fully supported), partial (partially supported), missing (no support), not_needed (no citation required)"
    },
    "recommended_action": {
      "type": "string",
      "description": "Actionable recommendation to resolve the gap, e.g. 'Find peer-reviewed source for BERT architecture definition'"
    },
    "recommended_query": {
      "type": "string",
      "description": "Suggested search query to find a missing source, e.g. 'BERT architecture transformer encoder pre-training'"
    },
    "created_at": {
      "type": "string",
      "format": "date-time",
      "description": "ISO 8601 timestamp when this binding was created"
    },
    "updated_at": {
      "type": "string",
      "format": "date-time",
      "description": "ISO 8601 timestamp of last update"
    }
  },
  "additionalProperties": false
}